{
  "$schema": "https://json-schema.org/draft/2020-12/schema",
  "$id": "https://github.com/JeffWouters/Claude-Skill-Idiolect/schemas/v1/check-report.schema.json",
  "title": "Output of check (and of write/rewrite with report=true)",
  "type": "object",
  "required": [
    "schema_version",
    "status"
  ],
  "properties": {
    "schema_version": {
      "$ref": "common.schema.json#/$defs/schemaVersion"
    },
    "status": {
      "enum": [
        "pass",
        "fail",
        "low_confidence",
        "no_slot",
        "no_store",
        "needs_input",
        "error"
      ]
    },
    "message": {
      "type": "string"
    },
    "question": {
      "type": "string",
      "description": "Present when status is needs_input."
    },
    "profile": {
      "$ref": "common.schema.json#/$defs/profileName"
    },
    "slot": {
      "$ref": "common.schema.json#/$defs/slotKey"
    },
    "confidence": {
      "$ref": "common.schema.json#/$defs/confidenceLevel"
    },
    "flagged": {
      "type": "integer",
      "minimum": 0,
      "description": "Number of metrics flagged."
    },
    "fail_threshold": {
      "type": "integer",
      "minimum": 1,
      "description": "The resolved fail count (spec §17.2): 4 for 11 to 14 applicable metrics. The draft fails when flagged >= fail_threshold."
    },
    "metrics": {
      "type": "array",
      "items": {
        "type": "object",
        "required": [
          "name",
          "draft",
          "writer",
          "ratio",
          "flag"
        ],
        "properties": {
          "name": {
            "type": "string"
          },
          "draft": {
            "type": "number"
          },
          "writer": {
            "type": "number",
            "description": "The target for this piece: the slot's value blended with the example passages the brief selects (design: Write and rewrite, step 2)."
          },
          "slot": {
            "type": "number",
            "description": "The slot's own value. A metric is flagged only when the draft is outside the band around both."
          },
          "ratio": {
            "type": [
              "number",
              "null"
            ],
            "description": "draft / writer; null when the writer's value is below the metric's floor (then judged by absolute difference, spec §17.1)."
          },
          "flag": {
            "enum": [
              "ok",
              "overshoot",
              "shortfall"
            ]
          },
          "primary": {
            "type": "boolean"
          }
        },
        "additionalProperties": false
      }
    },
    "targets": {
      "type": "object",
      "description": "How the targets for this piece were made.",
      "required": [
        "examples",
        "words",
        "weight"
      ],
      "properties": {
        "examples": {
          "type": "array",
          "items": {
            "type": "string"
          }
        },
        "words": {
          "type": "integer",
          "minimum": 0
        },
        "weight": {
          "type": "number",
          "minimum": 0,
          "maximum": 1,
          "description": "Share of the examples in the blend: words / (words + 300)."
        },
        "tone": {
          "type": "array",
          "items": {
            "enum": [
              "warm",
              "cool",
              "firm",
              "soft",
              "formal",
              "casual"
            ]
          },
          "description": "Tones asked for (spec §31): targets moved within the writer's own range."
        }
      },
      "additionalProperties": false
    },
    "bunched": {
      "type": "array",
      "description": "Habits used far above the writer's rate in one paragraph (design: Guardrails, No caricature). A revision trigger, not a fail by itself.",
      "items": {
        "type": "object",
        "required": [
          "paragraph",
          "habit",
          "count",
          "expected"
        ],
        "properties": {
          "paragraph": {
            "type": "integer",
            "minimum": 0,
            "description": "1-based; 0 means the whole text."
          },
          "habit": {
            "type": "string"
          },
          "count": {
            "type": "integer",
            "minimum": 0
          },
          "expected": {
            "type": "number",
            "minimum": 0
          }
        },
        "additionalProperties": false
      }
    },
    "flavour": {
      "type": "object",
      "description": "Language flavour in the text (spec §34.9).",
      "required": [
        "mode",
        "hits",
        "allowed",
        "expected",
        "markers"
      ],
      "properties": {
        "mode": {
          "enum": [
            "keep",
            "off"
          ]
        },
        "hits": {
          "type": "integer",
          "minimum": 0
        },
        "allowed": {
          "type": "integer",
          "minimum": 0
        },
        "expected": {
          "type": "number",
          "minimum": 0
        },
        "markers": {
          "type": "array",
          "items": {
            "type": "object",
            "required": [
              "id",
              "name",
              "count"
            ],
            "properties": {
              "id": {
                "type": "string"
              },
              "name": {
                "type": "string"
              },
              "count": {
                "type": "integer",
                "minimum": 0
              }
            },
            "additionalProperties": false
          }
        }
      },
      "additionalProperties": false
    },
    "flagged_lines": {
      "type": "array",
      "items": {
        "type": "object",
        "required": [
          "line",
          "text",
          "reason"
        ],
        "properties": {
          "line": {
            "type": "integer",
            "minimum": 1
          },
          "text": {
            "type": "string"
          },
          "lesson": {
            "type": "string",
            "description": "Id or slug of the lesson, ruling or never-list marker broken."
          },
          "reason": {
            "type": "string"
          }
        },
        "additionalProperties": false
      }
    },
    "ai_signs": {
      "type": "object",
      "description": "The built-in signs of machine-written text (spec §37). A found sign fails the draft; its lines are in flagged_lines with lesson a-NNN. A warned sign (a slot with fewer than 20 texts, §37.3) does not.",
      "required": [
        "version",
        "lang",
        "covered",
        "checked",
        "found",
        "allowed"
      ],
      "properties": {
        "version": {
          "type": "string"
        },
        "lang": {
          "type": "string"
        },
        "covered": {
          "type": "boolean",
          "description": "false when the language has no list: only the language-independent signs were checked."
        },
        "checked": {
          "type": "integer",
          "minimum": 0
        },
        "found": {
          "type": "array",
          "items": {
            "type": "string",
            "pattern": "^a-[0-9]{3}$"
          }
        },
        "allowed": {
          "type": "array",
          "items": {
            "type": "string",
            "pattern": "^a-[0-9]{3}$"
          },
          "description": "Signs this writer switched off (aisigns.py allow)."
        },
        "warned": {
          "type": "array",
          "items": {
            "type": "string",
            "pattern": "^a-[0-9]{3}$"
          },
          "description": "Signs the writer uses, shown above their allowance in a slot with fewer than 20 texts: a warning, not a fail."
        },
        "warned_lines": {
          "type": "array",
          "items": {
            "type": "object",
            "required": [
              "line",
              "text",
              "reason"
            ],
            "properties": {
              "line": {
                "type": "integer",
                "minimum": 1
              },
              "text": {
                "type": "string"
              },
              "lesson": {
                "type": "string",
                "description": "Id or slug of the lesson, ruling or never-list marker broken."
              },
              "reason": {
                "type": "string"
              }
            },
            "additionalProperties": false
          },
          "description": "The lines of the warned signs."
        }
      },
      "additionalProperties": false
    },
    "placeholders": {
      "type": "object",
      "description": "write.md's placeholders ([… needed: …]) in the text (spec §38): never a fail; the message warns about one in the opening paragraph.",
      "required": [
        "count",
        "in_opening"
      ],
      "properties": {
        "count": {
          "type": "integer",
          "minimum": 1
        },
        "in_opening": {
          "type": "boolean"
        }
      },
      "additionalProperties": false
    }
  },
  "additionalProperties": false,
  "allOf": [
    {
      "if": {
        "properties": {
          "status": {
            "const": "needs_input"
          }
        }
      },
      "then": {
        "required": [
          "question"
        ]
      }
    },
    {
      "if": {
        "properties": {
          "status": {
            "enum": [
              "pass",
              "fail",
              "low_confidence"
            ]
          }
        }
      },
      "then": {
        "required": [
          "profile",
          "slot",
          "confidence",
          "metrics",
          "flagged",
          "fail_threshold"
        ]
      }
    },
    {
      "if": {
        "properties": {
          "status": {
            "enum": [
              "no_slot",
              "no_store",
              "error"
            ]
          }
        }
      },
      "then": {
        "required": [
          "message"
        ]
      }
    }
  ]
}
