{
  "schema_version": 1,
  "status": "pass",
  "profile": "synthetic-noor",
  "slot": "en.essay",
  "confidence": "medium",
  "flagged": 3,
  "fail_threshold": 4,
  "metrics": [
    {
      "name": "sentence_length_sd",
      "draft": 3.329,
      "writer": 3.978,
      "slot": 3.6426,
      "ratio": 0.837,
      "flag": "ok",
      "primary": true
    },
    {
      "name": "sentences_per_paragraph",
      "draft": 6.875,
      "writer": 6.4051,
      "slot": 4.9275,
      "ratio": 1.073,
      "flag": "ok",
      "primary": false
    },
    {
      "name": "long_sentence_share",
      "draft": 0.0,
      "writer": 0.0,
      "slot": 0.0,
      "ratio": null,
      "flag": "ok",
      "primary": true
    },
    {
      "name": "sentence_length_mean",
      "draft": 6.4364,
      "writer": 7.1345,
      "slot": 6.8706,
      "ratio": 0.902,
      "flag": "ok",
      "primary": true
    },
    {
      "name": "commas_per_sentence",
      "draft": 0.0182,
      "writer": 0.2291,
      "slot": 0.2029,
      "ratio": 0.079,
      "flag": "shortfall",
      "primary": true
    },
    {
      "name": "semicolons_per_1k",
      "draft": 0.0,
      "writer": 0.0,
      "slot": 0.0,
      "ratio": null,
      "flag": "ok",
      "primary": false
    },
    {
      "name": "conjunction_opener_share",
      "draft": 0.0909,
      "writer": 0.1623,
      "slot": 0.1426,
      "ratio": 0.56,
      "flag": "ok",
      "primary": false
    },
    {
      "name": "contractions_per_1k",
      "draft": 0.0,
      "writer": 0.2589,
      "slot": 0.4281,
      "ratio": null,
      "flag": "ok",
      "primary": false
    },
    {
      "name": "dashes_per_1k",
      "draft": 0.0,
      "writer": 0.0,
      "slot": 0.0,
      "ratio": null,
      "flag": "ok",
      "primary": false
    },
    {
      "name": "colons_per_1k",
      "draft": 0.0,
      "writer": 0.7768,
      "slot": 1.2842,
      "ratio": 0.0,
      "flag": "ok",
      "primary": false
    },
    {
      "name": "short_sentence_share",
      "draft": 0.6182,
      "writer": 0.6131,
      "slot": 0.6368,
      "ratio": 1.008,
      "flag": "ok",
      "primary": false
    },
    {
      "name": "long_word_share",
      "draft": 0.0508,
      "writer": 0.0579,
      "slot": 0.0591,
      "ratio": 0.878,
      "flag": "ok",
      "primary": true
    },
    {
      "name": "hedges_per_1k",
      "draft": 2.8249,
      "writer": 0.1295,
      "slot": 0.214,
      "ratio": null,
      "flag": "overshoot",
      "primary": true
    },
    {
      "name": "digits_per_1k",
      "draft": 28.2486,
      "writer": 9.4696,
      "slot": 8.9897,
      "ratio": 2.983,
      "flag": "overshoot",
      "primary": false
    }
  ],
  "targets": {
    "examples": [
      "e-001",
      "e-004",
      "e-002"
    ],
    "words": 196,
    "weight": 0.3952
  }
}
